Image Url,Video Url,Product Desc,Origin Price,Discount Price,Discount,Sales180Day,Positive Feedback,Product Url
https://ae-pic-a1.aliexpress-media.com/kf/Sf796e8c6b65c40b8ba69b5c37ad0b6c33.jpg,,LOKI K5000 Table Tennis Racket Set 1pc/2pcs Home Entertainment Ping Pong Rackets with Blue Color Ping Pong Rubber,USD 6.59,USD 5.76,12%,485,90.9%,https://s.click.aliexpress.com/e/_ok8Tuvx
https://ae-pic-a1.aliexpress-media.com/kf/Sb53f3b3660884603af4eee0ee134ca5e3.jpg,https://video.aliexpress-media.com/play/u/ae_sg_item/2208108546500/p/1/e/6/t/10301/344167480364.mp4,27.2 28.6 31.8 34mm Suspension Damping Seat Tube E-bike Seatpost 300 350 500 550 600mm Folding Bike Aluminum Alloy Saddle Pole,USD 9.18,USD 6.43,30%,254,96.8%,https://s.click.aliexpress.com/e/_ooFM3Op
https://ae-pic-a1.aliexpress-media.com/kf/S0d941c2439274851ba2c156e5d43d06fP.jpg,https://video.aliexpress-media.com/play/u/ae_sg_item/6000641176/p/1/e/6/t/10301/4000257248080.mp4,1 Pair Wrist&Ankle Weights for Women Men Adjustable Weights Weight-bearing bracelet for Yoga sports Running Cardio Gym Workouts,USD 33.83,USD 20.30,40%,39,100.0%,https://s.click.aliexpress.com/e/_oly6jcz
https://ae-pic-a1.aliexpress-media.com/kf/Sced033168e9c496ab6e7479ef7acb19di.jpg,https://video.aliexpress-media.com/play/u/ae_sg_item/133155933195/p/1/e/6/t/10301/291628296935.mp4,ROCKBROS Bicycle Handlebar Tape Non-Slip Shock Absorbing Belt Ultralight Wear-Resistant Cycling Strap MTB Road Bike Accessories,USD 8.20,USD 7.24,11%,556,94.4%,https://s.click.aliexpress.com/e/_ombu43r
https://ae-pic-a1.aliexpress-media.com/kf/H5810322d8ac0466ab8c8560f32cb9bbaR.jpg,https://video.aliexpress-media.com/play/u/ae_sg_item/3935501486/p/1/e/6/t/10301/219647143675.mp4,ZOOM Bicycle Disc Brake Aluminum Alloy F160 R160 Mountain Road MTB Bike Mechanical Caliper Disc Brakes Cycling Double Brake,USD 11.65,USD 7.69,34%,151,97.9%,https://s.click.aliexpress.com/e/_oDwWygh
https://ae-pic-a1.aliexpress-media.com/kf/H4f66465eb914464095f3e33dab72b66bM.jpg,,Neoprene Life Jacket for Adult Children New Water Sport Buoyancy Jacket Life Vest Swimming Boating Skiing Driving Vest Drifting,USD 18.74,USD 14.24,24%,1027,96.3%,https://s.click.aliexpress.com/e/_oC8fhO1
https://ae-pic-a1.aliexpress-media.com/kf/S0f3255284f2b43edb4fe2d62cccfa1ebk.jpg,,2025 Helium FXR Gear Set mx Power Wear Off Road Jersey Set ATV kit Breathable Dirt Bike Combo Suit Motocross Kit,USD 140.71,USD 43.62,69%,262,87.6%,https://s.click.aliexpress.com/e/_oojvMVT
https://ae-pic-a1.aliexpress-media.com/kf/Se5856301a3a7481fa50e6fd45925411dS.jpg,,DRL LED Adjustable Headlights for Yamaha Raptor 700 700R YFZ450 YFZ450R YFZ450X Wolverine 450 350 Turn Signal Light 2006-2022,USD 156.83,USD 76.85,51%,163,92.5%,https://s.click.aliexpress.com/e/_oFLJ5SD
https://ae-pic-a1.aliexpress-media.com/kf/S64ddc4357e2e4a78988dea544d0834f6P.jpg,,DOT Adult Female Men Helmets Motocross Kask Cross Downhill Soporte Casco Off Road Helmet Racing Classic Motorcycle Original,USD 99.27,USD 34.74,65%,565,92.3%,https://s.click.aliexpress.com/e/_omhEB9n
https://ae-pic-a1.aliexpress-media.com/kf/S01bf0e0bec9b4ff69d0d7d36386a1131Q.jpg,https://video.aliexpress-media.com/play/u/ae_sg_item/2662561184/p/1/e/6/t/10301/1100143806917.mp4,2PCS Motorcycle Turn Signal Light E11 Mark Built Relay 335SMD Turn Signals Indicator Flashing Light Blinker Universal M10 Bolt,USD 12.21,USD 8.55,30%,306,92.1%,https://s.click.aliexpress.com/e/_opwiMJP
https://ae-pic-a1.aliexpress-media.com/kf/Hf517835c2a5b4e2e86a940e9c7215a60B.jpg,https://video.aliexpress-media.com/play/u/ae_sg_item/3497923325/p/1/e/6/t/10301/277425210367.mp4,Upgrade Brighter Lamp For BMW R1200GS F800GS F700GS F650 K1600  Motorcycle fog light Auxiliary Lights 40W 6000K,USD 116.67,USD 37.33,68%,473,96.3%,https://s.click.aliexpress.com/e/_olPZkVb
https://ae-pic-a1.aliexpress-media.com/kf/S67ed159fc3e944f197cbbe4da73ffe31Q.jpg,,OTOM Motorcycle 2023 Handguard Hand Guards Protector For KTM HUSQVARNA Brembo Braktec Hydraulic Clutch Brake SXF XCF FC TE ECF,USD 21.50,USD 15.05,30%,193,94.1%,https://s.click.aliexpress.com/e/_ooU7hGl
https://ae-pic-a1.aliexpress-media.com/kf/Sc95c0616f0bb44719f0dbd465133a311X.jpg,,Free Gift For Adults Children Professional Off-road Helmet Motorcycle Helmet Downhill DOT Racing Motorcycle Motor Helmet,USD 98.15,USD 33.37,66%,419,96.3%,https://s.click.aliexpress.com/e/_ooAPqwd
https://ae-pic-a1.aliexpress-media.com/kf/Sdba7b1b1dd934ef8aa06840ed578c11bA.jpg,,Motocross Glasses Motorcycle Cycling Goggles Helmet Anti Slip Glasses Motocross Glasses Motorcycle MTB Cycling Racing Off-Road,USD 7.72,USD 2.63,66%,257,96.1%,https://s.click.aliexpress.com/e/_oByckxr
https://ae-pic-a1.aliexpress-media.com/kf/Sbf3e83b0396c4c2dbad4fc047c9ed55fy.jpg,,Motorcycle Accessories New Meter Frame Cover Protector Protection For Honda ADV 350 ADV350 adv350 ADV 160 ADV160 2022 2023 2024,USD 8.19,USD 6.94,15%,438,88.7%,https://s.click.aliexpress.com/e/_oouojxL
https://ae-pic-a1.aliexpress-media.com/kf/S2f91539e38044245b50bf445256d7f3e8.jpg,,UTV Right & Left Window Net For Can-Am Maverick X3 2017-2021 Window Shade Shield Roll Cage Mesh Net Door Scratch Prevention,USD 68.29,USD 33.46,51%,83,98.7%,https://s.click.aliexpress.com/e/_oliniWl
https://ae-pic-a1.aliexpress-media.com/kf/S1236fe8405054da8b2b2edb0bf45f0b92.jpg,,Acerbis IMPACT EVO 3.0 - Safety kneecap outdoor sports off-road motorcycle (pair),USD 80.41,USD 51.46,36%,150,97.4%,https://s.click.aliexpress.com/e/_oBIafzP
https://ae-pic-a1.aliexpress-media.com/kf/Sae26f56ec31b49aabf53b1e7f41fc5f7w.png,https://video.aliexpress-media.com/play/u/ae_sg_item/252585605/p/1/e/6/t/10301/1100158085276.mp4,For HONDA X-ADV XADV 750 XADV750 2021 2022 2023 Accessories Folding Rear Foot Pegs Passenger Foot Rest Pedal Footrest Footpegs,USD 125.78,USD 38.99,69%,263,87.9%,https://s.click.aliexpress.com/e/_oowRRJx
https://ae-pic-a1.aliexpress-media.com/kf/Sc7532b3ed27343989e2fccb23c9677a90.jpg,,Personalised Dual Lens Flip Up Helmets Motocross Racing Modular Cascos Para Moto Men Women Fashion Full Face Motorcycle Helmet,USD 63.48,USD 29.20,54%,1492,91.3%,https://s.click.aliexpress.com/e/_oCm7SfP
https://ae-pic-a1.aliexpress-media.com/kf/S4f2c32205c1949a89d001973360d227ea.jpg,https://video.aliexpress-media.com/play/u/ae_sg_item/2672954326/p/1/e/6/t/10301/1100177415373.mp4,Super bright 3 Inch Dual Color LED Spotlights 200W Fog lamp Headlight Accessory For Motorcycle Truck Car SUV ATV 30000LM 24V 12V,USD 18.34,USD 16.08,12%,455,89.5%,https://s.click.aliexpress.com/e/_oF67jL3
https://ae-pic-a1.aliexpress-media.com/kf/S3d258eb1c81648d0b4cd586533ffa387t.jpg,,"UTV 300D Utility Vehicle Storage Cover Compatible With Polaris RZR PRO XP, RZR PRO R for Can-Am for Kawasaki 4-Seats Black",USD 96.21,USD 70.23,27%,45,96.0%,https://s.click.aliexpress.com/e/_onRhC6N
https://ae-pic-a1.aliexpress-media.com/kf/S38e90a34119d4f4b9dc5a5f868231fa2B.jpg,,10 Inch Tire 10X3.0 80/65-6 255X80 for Kaabo Mantis 10 Zero KUGOO Electric Scooter Front or Rear Wheel Tyre Accessories Parts,USD 7.57,USD 3.63,52%,151,97.8%,https://s.click.aliexpress.com/e/_ok6faQz
https://ae-pic-a1.aliexpress-media.com/kf/S90c84c5fc16e493699f9f8074cd3b6a8D.jpg,,13/15/16/17/18/19/20/21/22/inch Motorcycle series inner tube 90/90-19 110/90-17 110/70-17 130/60-13 3.00-18 130/90-16 130/90-15,USD 16.44,USD 8.71,47%,124,98.6%,https://s.click.aliexpress.com/e/_om6JUmH
https://ae-pic-a1.aliexpress-media.com/kf/Af1632a23f4fb4451a2daf816fcfbca0f1.jpg,,"2PCS 2FT LED Whip Lights,Remote Control Flagpole Antenna Whips,for UTV, ATV, Off Road, Truck, Sand, Buggy Dune, RZR",USD 94.34,USD 47.17,50%,84,96.5%,https://s.click.aliexpress.com/e/_ok9pSLJ
https://ae-pic-a1.aliexpress-media.com/kf/Hdd1ebafff25747d39430e38ca0603e51Z.jpg,https://video.aliexpress-media.com/play/u/ae_sg_item/1780290448/p/1/e/6/t/10301/298125275520.mp4,SCOYCO Motorcycle Gloves Summer Breathable Mesh Moto Gloves Touch Function Motorbike Gloves Motocross Off-Road Racing Gloves,USD 28.92,USD 14.75,49%,77,92.5%,https://s.click.aliexpress.com/e/_oEsXZdn
https://ae-pic-a1.aliexpress-media.com/kf/S7dbf3cb677ce412b87a93bd2488957b0o.jpg,,UTV Accessories 1680D RZR Storage Cab Bag RZR Center Seat Storage Bag for POLARIS RZR 1000 XP RZR 800 800S RZR 570 900,USD 41.98,USD 20.99,50%,93,95.4%,https://s.click.aliexpress.com/e/_okHMGbJ
https://ae-pic-a1.aliexpress-media.com/kf/Hda10b0da85494486930b1ce58c11d057w.jpg,,Aluminium Alloy Hanging Bag Hook For NINEBOT MAX G30 Electric Scooter Claw Hanger Gadget Hook E-bike Accessories,USD 12.54,USD 3.64,71%,1414,95.2%,https://s.click.aliexpress.com/e/_oCsbGuZ
https://ae-pic-a1.aliexpress-media.com/kf/S9c3ba01a1f8e433e84e9c2904fa048eeF.jpg,https://video.aliexpress-media.com/play/u/ae_sg_item/239194804/p/1/e/6/t/10301/1100217496462.mp4,Camping Gas Stove 2670W Portable Folding Cassette Gas Burner Outdoor Picnic Travel Cooking Grill Cooker Heating System,USD 84.73,USD 37.28,56%,1091,91.5%,https://s.click.aliexpress.com/e/_oF4nldP
https://ae-pic-a1.aliexpress-media.com/kf/S2a8d947e52954cf79f040d65d26f6f93H.jpg,,2024 Newesst Card Full English Sleeping Queens Board Game 2-5 People Family Gift Wake Up Queen Strategy Game Fun Childrens Toys,USD 8.38,USD 4.11,51%,1372,94.8%,https://s.click.aliexpress.com/e/_olQe0Bf
https://ae-pic-a1.aliexpress-media.com/kf/S68b34564943a419cb5063ba5b2133c3b6.jpg,https://video.aliexpress-media.com/play/u/ae_sg_item/205755010/p/1/e/6/t/10301/1100140514505.mp4,ATV Rear Rack Bag Package Storage Motorcycles Fuel Tank Bag Saddlebag For Yamaha 400 Compatible with Polaris 300 for Can Am,USD 52.48,USD 31.49,40%,107,92.0%,https://s.click.aliexpress.com/e/_oFUwfaZ
https://ae-pic-a1.aliexpress-media.com/kf/Se4c554d2bf314bdb93d88695b6e5297fV.jpg,,"2Pcs Children Swimming Gear Arm Swimming Rings Inflatable Kids Arm Float Rings Inflatable Arm Floaties, Safety Swimming Float Ar",USD 6.97,USD 3.41,51%,507,93.5%,https://s.click.aliexpress.com/e/_oocAvcd
https://ae-pic-a1.aliexpress-media.com/kf/S8a34a0fc63884720827e7d7be6af452dK.jpg,,500 Lumens Pistol Light Rechargeable Flashlight with Strobe Mode For Picatinny and GL Rails Mini Gun light,USD 10.35,USD 7.45,28%,1567,95.0%,https://s.click.aliexpress.com/e/_omIaYmN
https://ae-pic-a1.aliexpress-media.com/kf/S2f3f5859986b4ff1924fb704233abc723.jpg,,Tactical Chest Sling Bag Men's Riding Bags Hunting Gun Holster Backpacks Climbing Molle Fishing Pouch Archer Shoulder Backpack,USD 61.40,USD 17.19,72%,746,97.0%,https://s.click.aliexpress.com/e/_oE0x4z3
https://ae-pic-a1.aliexpress-media.com/kf/S071520f9946a4e0184d957cb7f5886f0n.jpg,,12V Motorcycle Red Sound System SD USB MP3 Motorcycle  Bluetooth Audio Remote Control Stereo 2 Speakers Waterproof FM  Radio,USD 97.89,USD 28.38,71%,85,95.7%,https://s.click.aliexpress.com/e/_oBA4Lrj
https://ae-pic-a1.aliexpress-media.com/kf/Sfe0ed76504b34b21bd89eabd4577483fj.png,,Podium FXR Black blue Motocross MX Jersey Set Dirt Bike Moto Gear Set ATV Motorcycle Combo Off Road Jersey And Pant,USD 145.15,USD 45.00,69%,113,91.3%,https://s.click.aliexpress.com/e/_oCDzeVx
https://ae-pic-a1.aliexpress-media.com/kf/S96f43f89c76442c3a52749407ddfd988q.jpg,https://video.aliexpress-media.com/play/u/ae_sg_item/2676025359/p/1/e/6/t/10301/1100182125171.mp4,Transparent rainproof shading cloth tarpaulin Lightweight waterproof tarpaulin cover tarpaulin transparent rainproof cloth,USD 17.40,USD 8.01,54%,2167,84.1%,https://s.click.aliexpress.com/e/_onxY5f7
https://ae-pic-a1.aliexpress-media.com/kf/Sa755c6c08f344042823f31a3abf1495dB.jpg,,Molten Basketball Official Certification Competition Basketball Standard Ball Men's Women's Training Ball Team Basketball,USD 34.59,USD 14.87,57%,1282,95.4%,https://s.click.aliexpress.com/e/_olWKhEp
https://ae-pic-a1.aliexpress-media.com/kf/Se6d0abac746e4e479117bf560c54ee60G.png,,Anchtek Motorcycle Alarm Disc Brake Lock Security Moto Wheel Disk Padlock Waterproof 110db Loud Anti Theft Alarma Motocicleta,USD 13.99,USD 6.99,50%,187,90.8%,https://s.click.aliexpress.com/e/_onIKG13
https://ae-pic-a1.aliexpress-media.com/kf/S4ce4bbd917ce456cbe9d3ddbbcac0302L.jpg,https://video.aliexpress-media.com/play/u/ae_sg_item/205755010/p/1/e/6/t/10301/1100057453426.mp4,2 Doors UTV 210D Oxford Cloth Protect Utility Vehicle Storage Cover from Rain Dirt Rays-Reflective for Can Am Maverick X3,USD 99.35,USD 54.64,45%,186,88.2%,https://s.click.aliexpress.com/e/_oB6sYvb
https://ae-pic-a1.aliexpress-media.com/kf/S02e2b79216334858b0269f2657b480d4N.jpg,,2025 TLD Racing Enduro Moto Suit Motocross Gear Set Off Road Jersey Set With Pocket Dirt Bike Jersey And Pants MX Racing Cloth,USD 154.78,USD 47.98,69%,137,94.4%,https://s.click.aliexpress.com/e/_oDabWQ9
https://ae-pic-a1.aliexpress-media.com/kf/S6163b0c3159b445f8f7cde4d5423e06bn.jpg,,Upgrade Brighter Lamp For BMW R1200GS F800GS F700GS F650 K1600 Motorcycle Fog Light Auxiliary Lights 40W 6000K,USD 70.81,USD 31.16,56%,1346,93.7%,https://s.click.aliexpress.com/e/_onvxICh
https://ae-pic-a1.aliexpress-media.com/kf/S85657e12129d4160bd220efe7a290545h.jpg,https://video.aliexpress-media.com/play/u/ae_sg_item/2606490458/p/1/e/6/t/10301/297337473806.mp4,DUHAN Windproof Motocross Jacket Motorcycle Pants Men Motorcycle Jacket Wear-resistant Body Armor Moto Clothing For Winter,USD 138.12,USD 44.20,68%,546,88.8%,https://s.click.aliexpress.com/e/_omOX7HB
https://ae-pic-a1.aliexpress-media.com/kf/S7f52459d1dda461494d9515b36faf98aZ.png,,2024 fh Moto MX Jersey Set Dirt Bike Podium FXR Motocross Gear Set ATV Motorcycle Combo Off Road Jersey And Pant,USD 143.59,USD 39.49,72%,427,91.3%,https://s.click.aliexpress.com/e/_ooZzPlX
https://ae-pic-a1.aliexpress-media.com/kf/S6fd71188ada7404586cbd14b43f502edb.jpg,https://video.aliexpress-media.com/play/u/ae_sg_item/251912814/p/1/e/6/t/10301/1100087795519.mp4,Motorcycle Helmets With Led Lights Moped Helmet Electric Scooter for Men Women With Double Visor Rechargeable Bicycle Light Bike,USD 79.31,USD 23.80,70%,1170,91.4%,https://s.click.aliexpress.com/e/_oFP0ZrF
https://ae-pic-a1.aliexpress-media.com/kf/S35778ffdbc8041bca5b6d3506e49cc77J.png,https://video.aliexpress-media.com/play/u/ae_sg_item/202823205/p/1/e/6/t/10301/1100153505216.mp4,Motorcycle Knee Pad Elbow Protective Combo Knee Protector Equipment Gear Outdoor Sport Motocross Knee Pad Ventilate Four Seasons,USD 44.36,USD 13.40,69%,1228,93.4%,https://s.click.aliexpress.com/e/_omzcRrj
https://ae-pic-a1.aliexpress-media.com/kf/S3d845e0590064607ab5ac5ee5492a05dW.jpg,https://video.aliexpress-media.com/play/u/ae_sg_item/2673050534/p/1/e/6/t/10301/1100196417485.mp4,New Motorcycle Helmet Rack 180° Rotation Wall Mounted Helmet Storage Holder Alloy Helmet Hanger Stand Hook for Bicycle Helmets,USD 29.00,USD 9.28,68%,523,95.7%,https://s.click.aliexpress.com/e/_okN2bRT
https://ae-pic-a1.aliexpress-media.com/kf/S462d5a4dca7c463c8e50562fc994842cK.png,,Podium FXR 2023 fh Moto Suit Motocross Gear Set Off Road Jersey Set With Pocket Dirt Bike Jersey And Pants MX Racing Clothing,USD 155.44,USD 42.59,72%,546,91.9%,https://s.click.aliexpress.com/e/_okJJN2D
https://ae-pic-a1.aliexpress-media.com/kf/S11ee1613fc9140ee8455d9081d3a6679e.jpg,,Multi-sizes Waterproof Hard EVA Case Storage Bag Travel Motorcycle Charger Bag Shockproof Protect Electric Car Power Organizer,USD 18.22,USD 6.02,67%,336,97.4%,https://s.click.aliexpress.com/e/_olP9sAd
https://ae-pic-a1.aliexpress-media.com/kf/S4747358f6e28466085220c4ea9aedb5aQ.png,,5 Color 2024 TLD RACING Prime Motocross Gear Set Moto Jersey Set Off Road Suit MX Race Wear Moto Suit Motorcycle Dirt Bike Kit,USD 135.47,USD 40.64,70%,531,92.4%,https://s.click.aliexpress.com/e/_oFWJRn7
https://ae-pic-a1.aliexpress-media.com/kf/Sc7e0a5e2662e4676a57a754b36da2c58B.jpg,https://video.aliexpress-media.com/play/u/ae_sg_item/230336938/p/1/e/6/t/10301/1100112750263.mp4,New Waterproof Motorcycle Tail Bag Multi-functional Durable Rear Motorcycle Seat Bag High Capacity Motorcycle Bag Rider Backpack,USD 111.63,USD 34.61,69%,355,96.5%,https://s.click.aliexpress.com/e/_oClqbHf
https://ae-pic-a1.aliexpress-media.com/kf/Sea7b85e4fa5a4c8cbd3c4e687f711d70N.jpg,,Belt Changing Tool for Polaris RZR 900 S 1000 XP Turbo Belt Removal Wrench Tools Solid Aluminum Alloy For Polaris RZR 1000 570,USD 13.77,USD 7.16,48%,87,94.7%,https://s.click.aliexpress.com/e/_okAfLX7
https://ae-pic-a1.aliexpress-media.com/kf/S48bfeb55942e46468f560cb630f36edbn.jpg,,For Yamaha XMAX300 XMAX250 XMAX400 XMAX125 X MAX XMAX 300 250 125 400 Motorcycle Accessories Electric Door Lock Decorative Cover,USD 13.41,USD 4.43,67%,494,93.0%,https://s.click.aliexpress.com/e/_olGL53x
https://ae-pic-a1.aliexpress-media.com/kf/Sc3935a42944e4643b33abbfe2713fcdaS.jpg,,Rechargeable Motorcycle Helmet Wiper Universal Waterproof helmet windshield wiper Compatible with Most Visor,USD 56.04,USD 18.49,67%,269,85.1%,https://s.click.aliexpress.com/e/_oCZ2yad
https://ae-pic-a1.aliexpress-media.com/kf/S3bb37310fb4147a995dcb3d320f74a95x.jpg,,10X2.50 Inner Tube 10x2.5 Camera with Bent Valve 45 90 Degree for 10 Inch Baby Stroller Pram Scooter Electric Scooter Skateboard,USD 7.20,USD 3.53,51%,399,92.5%,https://s.click.aliexpress.com/e/_oEvCeRX
https://ae-pic-a1.aliexpress-media.com/kf/S2a8ccb16067f4d4f860c38db322cfb30Q.jpg,https://video.aliexpress-media.com/play/u/ae_sg_item/252598292/p/1/e/6/t/10301/4000177360454.mp4,MOTOCENTRIC 28L Motorcycle Backpack Waterproof Outdoor Sports Riding Helmet Locomotive Backpack Business Travel Laptop Bag,USD 87.32,USD 26.19,70%,842,97.3%,https://s.click.aliexpress.com/e/_onz4jsV
https://ae-pic-a1.aliexpress-media.com/kf/H1f0e997671e74cd387c87c2dfe43d80cm.jpg,https://video.aliexpress-media.com/play/u/ae_sg_item/3165571102/p/1/e/6/t/10301/320897027224.mp4,Shockproof Protection Motocross MX MTB Knee Pads Dirt Bike Off-road Motorcycle Arm Sleeve Pads Moto Kneepads Elbow Brace S-XL,USD 39.87,USD 13.16,67%,339,92.6%,https://s.click.aliexpress.com/e/_op5tsrr
https://ae-pic-a1.aliexpress-media.com/kf/Sfe423bd8cbab4342b346a76c11dcd574V.jpg,,Topteng Heat-Resistant Net Seat Mesh Cover Universal For Motorcycle Scooter Motorbike XXXL Motorcycle Accessories,USD 13.43,USD 4.84,64%,500,90.7%,https://s.click.aliexpress.com/e/_oFuzEFB
https://ae-pic-a1.aliexpress-media.com/kf/S60c4277147e043f9ac25fae1243911a1N.jpg,https://video.aliexpress-media.com/play/u/ae_sg_item/2208081710161/p/1/e/6/t/10301/324683605888.mp4,Motorcycle Engine Crash Bars Bag For Yamaha T7 Tenere700 Tenere 700 2019 2020 2021 2022 - Travel Storage Tool Waterproof Bags,USD 44.66,USD 14.74,67%,308,92.9%,https://s.click.aliexpress.com/e/_o2CHAGD
https://ae-pic-a1.aliexpress-media.com/kf/S068e64b5ab02451d83b55211a6ef29ddu.jpg,https://video.aliexpress-media.com/play/u/ae_sg_item/2208454543945/p/1/e/6/t/10301/314390784089.mp4,Motorbike Casco Go Kart Scooter Motor Van Motorcycle Dual Lens Vintage Helmets Four Seasons Racing Half Helmets Casque Helmet,USD 85.79,USD 27.45,68%,864,90.7%,https://s.click.aliexpress.com/e/_onTE7c9
https://ae-pic-a1.aliexpress-media.com/kf/S28d55758c07046dd8d781475ba1f2119u.jpg,,"12 Inch Tyre 12 1/2x2 1/4 Outer Tire 12x2.125/2.35 Inner Tube for Electric Scooters Folding Bike Baby Carrier,bicycle Wheels",USD 7.08,USD 3.68,48%,238,88.9%,https://s.click.aliexpress.com/e/_o2bgXJj
https://ae-pic-a1.aliexpress-media.com/kf/S28dbd95312884b48bece74c0fc67ea83d.jpg,,13PCS Chain Repair Tool Set Motorcycle Chain Splitter Breaker Motorbike Mountainb Riveting Tool Heavy Duty Link O Ring Bicycle,USD 35.54,USD 16.70,53%,320,88.6%,https://s.click.aliexpress.com/e/_ooJMOlb
https://ae-pic-a1.aliexpress-media.com/kf/Sd750869a652f4895af6f6560bae80ef6S.png,,Mountain Bike Handlebar Cover Grips Comfortable Ergonomic Soft Rubber Anti-slip Lock on Handle Cycling Bicycle MTB Grip Bar End,USD 6.74,USD 6.04,10%,337,94.8%,https://s.click.aliexpress.com/e/_oklQlBF
https://ae-pic-a1.aliexpress-media.com/kf/S48f31ce48c434aa489ad5d35d84b9a4ck.jpg,,3 in 1 Electric Air Pump with Lights Mini Wireless Air Compressor USB Charging Inflator/Deflator Pumps for Outdoor Camping,USD 8.70,USD 7.66,11%,1071,94.5%,https://s.click.aliexpress.com/e/_oDtZDjF
https://ae-pic-a1.aliexpress-media.com/kf/Sf1dd744be4b8483b93db3a645454ef25x.jpg,https://video.aliexpress-media.com/play/u/ae_sg_item/133155933195/p/1/e/6/t/10301/309268296772.mp4,ROCKBROS Bicycle Pump130PSI  Air Pump Aluminum Alloy Portable Drop-proof Bike Ultralight Hand Pump MTB Mountain Bike Pump,USD 16.26,USD 14.41,11%,322,93.2%,https://s.click.aliexpress.com/e/_oE81ZvX
https://ae-pic-a1.aliexpress-media.com/kf/S04bc9f61fd7643309a449a110e7c23b2r.jpg,,INBIKE Shockproof GEL Pad Cycling Gloves Half Finger Sport Gloves Men Women Summer Bicycle Gym Fitness Gloves MTB Gloves IF239,USD 7.11,USD 6.33,10%,824,94.3%,https://s.click.aliexpress.com/e/_o2bvaFJ
https://ae-pic-a1.aliexpress-media.com/kf/Sf7abe1af027d4e259d1e58df193e477a3.jpg,,Bicycle Helmets Mtb Full Face Ultralight Integral Men's Cycling Helmet CE Safety Casco Mountain Bike Downhill DH Accessories,USD 97.13,USD 56.34,42%,18,100.0%,https://s.click.aliexpress.com/e/_opvZSKH
https://ae-pic-a1.aliexpress-media.com/kf/S8da6ec98773a45cbbd89a4ddd8435859p.jpg,https://video.aliexpress-media.com/play/u/ae_sg_item/239442535/p/1/e/6/t/10301/4000181346313.mp4,Full Face MTB Cycling Helmet for Man Adult DH BMX Off-Road Integral Helmet Downhill Mtb Ultralight CE CPSC Safety Ciclismo,USD 91.90,USD 45.03,51%,276,95.1%,https://s.click.aliexpress.com/e/_opdpPYz
https://ae-pic-a1.aliexpress-media.com/kf/S098f5b07d35d4c259333f172448fea25e.jpg,https://video.aliexpress-media.com/play/u/ae_sg_item/233046705/p/1/e/6/t/10301/1100180909208.mp4,Funsea Bicycle Saddle Wheelie Black With Logos Seat For Bicycles Flannelette Bike Seats Embroidery Logo 8mm Rail,USD 29.00,USD 25.46,12%,3046,97.1%,https://s.click.aliexpress.com/e/_oEPCNc5
https://ae-pic-a1.aliexpress-media.com/kf/Hf831d2c897a440f7adead02f0831728fi.jpg,https://video.aliexpress-media.com/play/u/ae_sg_item/206007133/p/1/e/6/t/10301/1100069735539.mp4,Copozz Men Women Winter Ski Gloves Waterproof Ultralight Snowboard Gloves Motorcycle Riding Snow Keep Warm Windproof Gloves,USD 19.55,USD 16.45,15%,994,97.6%,https://s.click.aliexpress.com/e/_o2bUbM9
https://ae-pic-a1.aliexpress-media.com/kf/H5baf7f00058a43c2aa4df46b704f2bc5u.jpg,https://video.aliexpress-media.com/play/u/ae_sg_item/2211079523090/p/1/e/6/t/10301/318288359795.mp4,1 Pair Ceramic MTB Bicycle Disc Brake Pads For SHIMANO SRAM AVID HAYES MAGURA FORMULA HOPE Cycling Parts Bike Accessory,USD 1.41,USD 1.25,11%,1218,96.6%,https://s.click.aliexpress.com/e/_oDAEPxx
https://ae-pic-a1.aliexpress-media.com/kf/Sefc7a1874107463596418d48ad93c143v.jpg,https://video.aliexpress-media.com/play/u/ae_sg_item/2659609379/p/1/e/6/t/10301/1100007810600.mp4,PACOONE Outdoor Camping Sleeping Pad Inflatable Mattress with Pillows Ultralight Air Mat Built-in Inflator Pump Travel Hiking,USD 43.79,USD 19.27,56%,3246,95.3%,https://s.click.aliexpress.com/e/_oo3anhJ
https://ae-pic-a1.aliexpress-media.com/kf/S0cc6d37a6c3945cfb771d3034960ad30v.jpg,https://video.aliexpress-media.com/play/u/ae_sg_item/143367124/p/1/e/6/t/10301/4000163026353.mp4,ROCKBROS Light Bracket Mountain Road Bicycle Code Table Holder Nylon Extension Frame Sports Camera Lamp Extension Base Accessory,USD 6.13,USD 5.06,17%,915,97.1%,https://s.click.aliexpress.com/e/_oC08P1J
https://ae-pic-a1.aliexpress-media.com/kf/Sab660ddd6bf445cc9a827087af1e777eE.jpg,,Electric Air Pump Portable Wireless Air Compressor Inflator/Deflator Pumps for Inflatable Cushions Air Beds Boat Swimming Ring,USD 8.56,USD 7.51,12%,5114,93.9%,https://s.click.aliexpress.com/e/_oDhuBQ1
https://ae-pic-a1.aliexpress-media.com/kf/S513343e0f1f24eedb462f1e89722b744N.jpg,https://video.aliexpress-media.com/play/u/ae_sg_item/231849824/p/1/e/6/t/10301/1100199612356.mp4,Full Face Helmet Cycling Safety Protection Bicycle Integral Helmet Downhill Mtb PC+EPS  Men's Mtb Helmet Motorcycle Racing Bike,USD 98.18,USD 54.00,45%,31,92.0%,https://s.click.aliexpress.com/e/_oDWstmD